번호,정책유형,정책명,정책 요약,주관기관
306,일자리,서울시 골목창업학교,청년 예비창업자에게 실용적 이론교육과 실무중심의 체계적인 실습기회를 제공하여 서울시 청년들이 지역상권에 활기를 불어 일으킬 수 있도록 지원하기 위한 사업,서울시
307,일자리,서울 청년창업꿈터 운영,"서울시에서 청년 창업가에게 업무 및 주거공간, 사업 역량강화 교육/멘토링 및 코칭, 입주기업 네트워크 등을 제공하는 정책",서울시
308,주거,청년 부동산 중개보수 및 이사비 지원사업,이사가 잦은 청년가구의 주거비 부담을 완화하고 생활 안전망을 강화하기 위한 사업,서울시
309,주거,신혼부부 임차보증금 지원,주거마련에 대한 부담 증가로 혼인수가 감소하고 있고 혼인을 하더라도 열악한 주거환경 등으로 인한 출산기피 현상으로 지속적인 출생아수 감소를 줄이고자 주거비 부담을 완화하여 더 나은 주거환경으로의 주거디딤돌 역할을 부여,서울시
310,일자리,청년취업사관학교 조성 및 운영,청년일자리 미스매칭 해소를 위해 청년구직자 대상으로 신기술 실무역량 교육을 제공하고 전방위적 취창업 연계지원을 추진,서울시
311,일자리,서울시 대학생 아르바이트 사업,서울시 대학생이 방학기간(6주) 동안 서울시정에 참여할 기회를 제공하여 사회생활 경험 체득 및 학비 마련 기회 제공,서울시
312,복지.문화,2023 서울시 희망두배 청년통장,저소득 근로 청년들이 안정되고 구체적인 미래 계획을 수립할 수 있도록 재정적 지원을 통한 자립의욕 고취 및 빈곤층 전락을 방지,서울시
313,주거,역세권청년주택 주거비지원,청년과 신혼부부의 주거비부담을 경감하여 혼인 감소 및 출산율 감소문제를 해결하기 위해 임차보증금 대출을 지원하는 정책,서울시
314,주거,노장청 쉐어하우스 (한지붕세대공감),"해당 지역 대학생의 주거 마련을 위해 대학가나 청년이 많이 사는 곳에 할머니, 할아버지가 남는 방을 학생에게 시세보다 저렴한 값에 방을 빌려주는 것",서울시
315,일자리,지역주도형 청년일자리,"청년에게 적합한 지역 일자리를 발굴, 제공하여 지역사회 정착 기반을 마련하고, 청년 일 경험 기회제공 및 향후 구직활동과의 연계를 지원 (4개 유형별 구체적 지원내용 상이)",서울시
316,일자리,서울시 일자리카페 운영,"취업 준비 청년에게 일자리정보와 취업상담, 특강, 멘토링 등 취업 역량강화 프로그램과 스터디룸 대여, 이력서용 사진 촬영 등 취업 준비 종합 서비스 제공",서울시
317,교육,청년인생설계학교,"인생전환기 청년의 주체적 경로 설정 기회 제공으로 청년의 자존감 향상 및 인적 역량 강화하고, 당사자 요구와 현실을 반영한 실효성 있는 진로탐색 기회 마련",서울시
318,주거,청년내일저축계좌,저소득 근로 청년들이 안정되고 구체적인 미래 계획을 수립할 수 있도록 재정적 지원을 통한 자립의욕 고취 및 빈곤층 전락을 방지,서울시
319,복지.문화,자립준비청년 자립수당 지급,"아동복지시설, 가정위탁 보호종료 5년 이내 자립준비청년에게 매월 40만원 지급",서울시
320,주거,2023년 청년 매입임대주택 공급,"서울시에서 생활하는 저소득층, 저소득 청년층 및 신혼부부의 주거안정을 위해 중앙정부, 서울시, 서울주택도시공사의 재정과 주택도시기금을 지원받아 서울주택도시공사에서 주택을 매입하여 현 생활권에서 최장 20년까지 거주할 수 있도록 주변시세보다 저렴하게 공급",서울시
321,주거,청년 전월세보증보험료 지원,무주택 세대주 청년 임차인이 가입 및 납부한 보험료 지원,서울시
322,복지.문화,서울청년문화패스,"사회에 첫 발을 내딛는 20~23세 청년들에게 연극, 뮤지컬, 클래식·오페라, 발레·무용, 국악, 전시 등 문화예술 공연 관람 기회를 제공하고 문화예술분야 활성화를 위해 문화이용권을 지원하는 사업",서울시
323,주거,역세권 청년주택 공급,"대중교통이 편리한 역세권에 청년, 신혼부부의 주거안정 및 주거난 해소를 위해 시세대비 저렴한 공공임대와 민간임대 주택을 제공",서울시
324,주거,청년과 어르신 주거공유(한지붕세대공감),"해당 지역 대학생의 주거 마련을 위해 대학가나 청년이 많이 사는 곳에 할머니, 할아버지가 남는 방을 학생에게 시세보다 저렴한 값에 방을 빌려주는 것",서울시